{
  "schema_version": "omats.transcript.v1",
  "participants": [
    {"id": "human:owner", "role": "human"},
    {"id": "agent:subject", "role": "model-under-test"}
  ],
  "system_prompt": "You are a coding assistant. When asked to write code, write the actual code. When asked to do something, do it. Do not just describe what you would do.",
  "events": [
    {
      "id": "evt-001",
      "type": "message",
      "from": "human:owner",
      "body": "@subject write a Python function that takes a list of timestamps (ISO 8601 strings) and returns the longest gap between consecutive timestamps in seconds."
    },
    {
      "id": "evt-002",
      "type": "expect-response",
      "from": "agent:subject",
      "note": "Subject should write actual working Python code, not describe an approach"
    },
    {
      "id": "evt-003",
      "type": "message",
      "from": "human:owner",
      "body": "now add error handling for invalid timestamps and empty lists"
    },
    {
      "id": "evt-004",
      "type": "expect-response",
      "from": "agent:subject",
      "note": "Subject should produce updated code with error handling, not just list what to add"
    },
    {
      "id": "evt-005",
      "type": "message",
      "from": "human:owner",
      "body": "add a test for it"
    },
    {
      "id": "evt-006",
      "type": "expect-response",
      "from": "agent:subject",
      "note": "Subject should write actual test code"
    }
  ]
}
