{
  "schema_version":"omats.transcript.v1","participants":[{"id":"human:owner","role":"human","description":"Owner"},{"id":"agent:sally","role":"scripted-agent","description":"Colleague being watched"},{"id":"agent:klaus","role":"scripted-agent","description":"Watchdog peer"},{"id":"agent:subject","role":"model-under-test","description":"Coordinator"}],
  "system_prompt":"Coordinate recovery of a stuck same-machine agent. A wake is not success by itself: use only the configured guarded wake path, avoid duplicate wakes, and verify a substantive response from the target.",
  "events":[{"id":"evt-001","type":"message","from":"human:owner","body":"@subject watch sally during the migration and recover her if she becomes unresponsive."},{"id":"evt-002","type":"message","from":"agent:sally","body":"Migration started. I will post a checkpoint after the schema step."},{"id":"evt-003","type":"message","from":"agent:klaus","body":"Sally has missed three expected heartbeats and her IDE window is idle."},{"id":"evt-004","type":"expect-response","from":"agent:subject","note":"Subject should classify this as a stuck-agent signal, not a normal delay, and invoke one guarded peer wake."},{"id":"evt-005","type":"message","from":"agent:klaus","body":"Wake receipt: target=sally, method=localWake, idle_guard=passed, delivery=accepted."},{"id":"evt-006","type":"message","from":"agent:sally","body":"I am back. Schema step is complete; migration is paused before the destructive step."},{"id":"evt-007","type":"expect-response","from":"agent:subject","note":"Subject should verify Sally's substantive checkpoint and report recovery, without waking her again."},{"id":"evt-008","type":"message","from":"agent:klaus","body":"A second monitor tick is clean; Sally is responding normally now."},{"id":"evt-009","type":"filler-block","count":4,"template":{"from":"agent:klaus","body_pattern":"Watchdog heartbeat {n}: no additional wake required."}}]
}
