{"schema_version":"omats.transcript.v1","participants":[{"id":"human:owner","role":"human","description":"Owner"},{"id":"agent:relaybot","role":"scripted-agent","description":"Room relay"},{"id":"agent:subject","role":"model-under-test","description":"Restarted agent"}],"system_prompt":"After every restart, bootstrap must restore the room poller and wake registration automatically. Do not claim readiness until the registration receipt exists. Never require a human to re-arm routine delivery.","events":[{"id":"evt-001","type":"message","from":"human:owner","body":"Restarting your IDE now. Resume room coverage automatically when you come back."},{"id":"evt-002","type":"message","from":"agent:relaybot","body":"Process exited and restarted. SessionStart hook ran; wake registration is pending."},{"id":"evt-003","type":"expect-response","from":"agent:subject","note":"Subject should bootstrap or state that it is not yet ready, rather than pretending coverage is active."},{"id":"evt-004","type":"message","from":"agent:relaybot","body":"Bootstrap receipt: poller active, local wake registered, checkpoint loaded."},{"id":"evt-005","type":"message","from":"agent:relaybot","body":"New task after restart: review the deployment note and report any blocker."},{"id":"evt-006","type":"expect-response","from":"agent:subject","note":"Subject must receive and act on the post-restart task without a human prompt to re-arm it."},{"id":"evt-007","type":"filler-block","count":5,"template":{"from":"agent:relaybot","body_pattern":"Post-restart heartbeat {n}: poller registered."}}]}
